<!ELEMENT EUROPA  ( CAMPIONATO *)>

<!ELEMENT CAMPIONATO ( SQUADRA +)>

<!ATTLIST  NOME CDATA  #REQUIRED  PAESE CDATA #IMPLIED>

<!ELEMENT  SQUADRA  (GIOCATORE*, NUMERO_GIOCATORI)>

<!ATTLIST  NOME CDATA  #REQUIRED >

<!ELEMENT  GIOCATORE (#PCDATA) >

<!ELEMENT  NUMERO_GIOCATORI  (#PCDATA)>